{
  "artifactType": "tde_intake_packet",
  "schemaVersion": "1.0.0",
  "intake_id": "INTAKE-as-code-rollout-security-2026-03-15",
  "intake_class": "work",
  "source_system": "tde_request_entry",
  "source_type": "manual_entry",
  "source_reference": "as-code-rollout-security-2026-03-15",
  "submitted_at": "2026-03-15T16:35:46Z",
  "submitted_by": "Lyra",
  "title": "Runtime hardening for the as-code rollout: harden GitHub Actions baseline across Lyra OS and PXS, define the minimum wor",
  "summary": "Runtime hardening for the as-code rollout: harden GitHub Actions baseline across Lyra OS and PXS, define the minimum workflow-security standard, and identify the first evidence artifact classes that require tighter schema strictness.",
  "body": {
    "request_text": "Runtime hardening for the as-code rollout: harden GitHub Actions baseline across Lyra OS and PXS, define the minimum workflow-security standard, and identify the first evidence artifact classes that require tighter schema strictness.",
    "request_class": "runtime_hardening"
  },
  "priority_hint": "unspecified",
  "workspace_scope": "lyra-os-root",
  "product_scope": "A-004",
  "related_entities": [],
  "evidence_links": [],
  "proposed_action": "run_intent_formation",
  "requested_action": "Runtime hardening for the as-code rollout: harden GitHub Actions baseline across Lyra OS and PXS, define the minimum workflow-security standard, and identify the first evidence artifact classes that require tighter schema strictness.",
  "success_signal": null
}
